{
  "id": 173,
  "name": "Smite",
  "cost": 3,
  "type": "spell",
  "tribe": "goblin",
  "rarity": "common",
  "description": "Deal 3 damage to any target. If you control a Goblin, deal 4 instead.",
  "stackEffects": [
    {
      "effect": "dealDamage",
      "targetType": "any",
      "amount": 3,
      "amountModifier": "+1",
      "modifierConditions": [
        {
          "condition": "control",
          "tribe": "goblin",
          "minAmount": 1
        }
      ]
    }
  ]
}