{
  "id": 96,
  "name": "Dusk Wraith",
  "cost": 0,
  "type": "summon",
  "attack": 1,
  "defense": 1,
  "tribe": "shadow",
  "rarity": "common",
  "description": "When Dusk Wraith is milled, destroy target summon. If you can't, gain 3 LPs.",
  "triggeredEffects": [
    {
      "trigger": "mill",
      "scope": "selfOnly",
      "description": "Destroy target summon. If you can't, gain 3 LPs.",
      "effects": [
        {
          "effect": "destroy",
          "targetType": "summon",
          "conditions": [{ "condition": "summonsInPlay" }]
        },
        {
          "effect": "gainLife",
          "amount": 3,
          "conditions": [{ "condition": "noSummonsInPlay" }]
        }
      ]
    }
  ]
}