{
  "id": 146,
  "name": "Transparent Goblin",
  "cost": 0,
  "type": "summon",
  "attack": 1,
  "defense": 1,
  "tribe": "goblin",
  "rarity": "common",
  "description": "Transparent Goblin does not count as your summon for turn.",
  "passiveEffects": [
    {  
      "passive": "bypassSummonLimit"
    }
  ] 
}