{
  "id": 51,
  "name": "Merfolk Gazer",
  "cost": 0,
  "type": "summon",
  "attack": 0,
  "defense": 1,
  "tribe": "merfolk",
  "rarity": "common",
  "description": "When Merfolk Gazer enters play, opponents reveal their hands.",
  "triggeredEffects": [
  {
    "trigger": "enteredZone",
    "zone": "play",
    "effects": [
      {
        "effect": "reveal",
        "sourcePlayer": "opponent"
      }
    ]
  }
  ]
}