{
  "id": 53,
  "name": "Merfolk Rusher",
  "cost": 0,
  "type": "summon",
  "attack": 4,
  "defense": 3,
  "tribe": "merfolk",
  "rarity": "common",
  "description": "When Merfolk Rusher enters play, sacrifice it unless you return a merfolk you control to your hand.",
  "triggeredEffects": [
    {
      "trigger": "enteredZone",
      "zone": "play",
      "scope": "selfOnly",
      "effects": [
        {
          "effect": "choose",
          "choices": [
            [
              {
                "effect": "sacrifice",
                "scope": "selfOnly"
              }
            ],
            [
              {
                "effect": "sendToZone",
                "target": {
                  "type": "summon"
                },
                "tribe": "merfolk",
                "destination": "hand"
              }
            ]
          ]
        }
      ]
    }
  ]
}